movieID,movieDescription,movieScores,userReviews,criticReviews,metascore,nominationUrl,storyLine,taglines,genres,certificate,cast,faq,videos,photos,technicalSpecs
VGhlIElyb24gQ2xhdw==,"The true story of the inseparable Von Erich brothers, who made history in the intensely competitive world of professional wrestling in the early 1980s.","[<li class=""ipc-inline-list__item sc-9e83797f-1 cxyOpW"" role=""presentation""><a aria-disabled=""false"" class=""ipc-link ipc-link--baseAlt ipc-link--touch-target sc-9e83797f-2 cfrylA isReview"" href=""/title/tt21064584/reviews/?ref_=tt_ov_rt"" role=""button"" tabindex=""0""><span class=""three-Elements""><span class=""score"">296</span><span class=""label"">User reviews</span></span></a></li>, <li class=""ipc-inline-list__item sc-9e83797f-1 cxyOpW"" role=""presentation""><a aria-disabled=""false"" class=""ipc-link ipc-link--baseAlt ipc-link--touch-target sc-9e83797f-2 cfrylA isReview"" href=""/title/tt21064584/externalreviews/?ref_=tt_ov_rt"" role=""button"" tabindex=""0""><span class=""three-Elements""><span class=""score"">207</span><span class=""label"">Critic reviews</span></span></a></li>, <li class=""ipc-inline-list__item sc-9e83797f-1 cxyOpW"" role=""presentation""><a aria-disabled=""false"" class=""ipc-link ipc-link--baseAlt ipc-link--touch-target sc-9e83797f-2 cfrylA isReview"" href=""/title/tt21064584/criticreviews/?ref_=tt_ov_rt"" role=""button"" tabindex=""0""><span class=""three-Elements""><span class=""score""><span class=""sc-b0901df4-0 bcQdDJ metacritic-score-box"" style=""background-color:#54A72A"">73</span></span><span class=""label""><span class=""metacritic-score-label"">Metascore</span></span></span></a></li>]","['/title/tt21064584/reviews/?ref_=tt_ov_rt', '296', 'User reviews']","['/title/tt21064584/externalreviews/?ref_=tt_ov_rt', '207', 'Critic reviews']","['/title/tt21064584/criticreviews/?ref_=tt_ov_rt', '73', '73']",/title/tt21064584/fullcredits/cast?ref_=tt_ov_st_sm,"The film had its world premiere in Dallas, Texas the same evening that the SAG-AFTRA strike ended. Many of the actors found out the news through journalists on the red carpet.",3 wins & 37 nominations,DirectorSean Durkin,3 wins & 37 nominations,/title/tt21064584/fullcredits/cast/?ref_=tt_cl_sm,/title/tt21064584/faq/?ref_=tt_faq_sm,/title/tt21064584/videogallery/?ref_=tt_vi_sm,/title/tt21064584/mediaviewer/rm2019641601/?ref_=tt_mi_sm,/title/tt21064584/technical?ref_=tt_spec_sm
QXBvY2FseXBzZSBOb3c=,A U.S. Army officer serving in Vietnam is tasked with assassinating a renegade Special Forces Colonel who sees himself as a god.,"[<li class=""ipc-inline-list__item sc-9e83797f-1 cxyOpW"" role=""presentation""><a aria-disabled=""false"" class=""ipc-link ipc-link--baseAlt ipc-link--touch-target sc-9e83797f-2 cfrylA isReview"" href=""/title/tt0078788/reviews/?ref_=tt_ov_rt"" role=""button"" tabindex=""0""><span class=""three-Elements""><span class=""score"">1.4K</span><span class=""label"">User reviews</span></span></a></li>, <li class=""ipc-inline-list__item sc-9e83797f-1 cxyOpW"" role=""presentation""><a aria-disabled=""false"" class=""ipc-link ipc-link--baseAlt ipc-link--touch-target sc-9e83797f-2 cfrylA isReview"" href=""/title/tt0078788/externalreviews/?ref_=tt_ov_rt"" role=""button"" tabindex=""0""><span class=""three-Elements""><span class=""score"">297</span><span class=""label"">Critic reviews</span></span></a></li>, <li class=""ipc-inline-list__item sc-9e83797f-1 cxyOpW"" role=""presentation""><a aria-disabled=""false"" class=""ipc-link ipc-link--baseAlt ipc-link--touch-target sc-9e83797f-2 cfrylA isReview"" href=""/title/tt0078788/criticreviews/?ref_=tt_ov_rt"" role=""button"" tabindex=""0""><span class=""three-Elements""><span class=""score""><span class=""sc-b0901df4-0 bcQdDJ metacritic-score-box"" style=""background-color:#54A72A"">94</span></span><span class=""label""><span class=""metacritic-score-label"">Metascore</span></span></span></a></li>]","['/title/tt0078788/reviews/?ref_=tt_ov_rt', '1.4K', 'User reviews']","['/title/tt0078788/externalreviews/?ref_=tt_ov_rt', '297', 'Critic reviews']","['/title/tt0078788/criticreviews/?ref_=tt_ov_rt', '94', '94']",/title/tt0078788/fullcredits/writer?ref_=tt_ov_wr_sm,"The United States military refused to lend Francis Ford Coppola any military equipment, due to the order to ""kill Colonel Kurtz"". Coppola instead had to borrow local military equipment.",21 wins & 33 nominations total,DirectorFrancis Ford Coppola,21 wins & 33 nominations total,/title/tt0078788/fullcredits/cast/?ref_=tt_cl_sm,/title/tt0078788/faq/?ref_=tt_faq_sm,/title/tt0078788/videogallery/?ref_=tt_vi_sm,/title/tt0078788/mediaviewer/rm1863264512/?ref_=tt_mi_sm,/title/tt0078788/technical?ref_=tt_spec_sm
UHVscCBGaWN0aW9u,"The lives of two mob hitmen, a boxer, a gangster and his wife, and a pair of diner bandits intertwine in four tales of violence and redemption.","[<li class=""ipc-inline-list__item sc-9e83797f-1 cxyOpW"" role=""presentation""><a aria-disabled=""false"" class=""ipc-link ipc-link--baseAlt ipc-link--touch-target sc-9e83797f-2 cfrylA isReview"" href=""/title/tt0110912/reviews/?ref_=tt_ov_rt"" role=""button"" tabindex=""0""><span class=""three-Elements""><span class=""score"">3.7K</span><span class=""label"">User reviews</span></span></a></li>, <li class=""ipc-inline-list__item sc-9e83797f-1 cxyOpW"" role=""presentation""><a aria-disabled=""false"" class=""ipc-link ipc-link--baseAlt ipc-link--touch-target sc-9e83797f-2 cfrylA isReview"" href=""/title/tt0110912/externalreviews/?ref_=tt_ov_rt"" role=""button"" tabindex=""0""><span class=""three-Elements""><span class=""score"">273</span><span class=""label"">Critic reviews</span></span></a></li>, <li class=""ipc-inline-list__item sc-9e83797f-1 cxyOpW"" role=""presentation""><a aria-disabled=""false"" class=""ipc-link ipc-link--baseAlt ipc-link--touch-target sc-9e83797f-2 cfrylA isReview"" href=""/title/tt0110912/criticreviews/?ref_=tt_ov_rt"" role=""button"" tabindex=""0""><span class=""three-Elements""><span class=""score""><span class=""sc-b0901df4-0 bcQdDJ metacritic-score-box"" style=""background-color:#54A72A"">95</span></span><span class=""label""><span class=""metacritic-score-label"">Metascore</span></span></span></a></li>]","['/title/tt0110912/reviews/?ref_=tt_ov_rt', '3.7K', 'User reviews']","['/title/tt0110912/externalreviews/?ref_=tt_ov_rt', '273', 'Critic reviews']","['/title/tt0110912/criticreviews/?ref_=tt_ov_rt', '95', '95']",/title/tt0110912/fullcredits/writer?ref_=tt_ov_wr_sm,Take a look back at Samuel L. Jackson's movie career in photos.,69 wins & 72 nominations total,DirectorQuentin Tarantino,69 wins & 72 nominations total,/title/tt0110912/fullcredits/cast/?ref_=tt_cl_sm,/title/tt0110912/faq/?ref_=tt_faq_sm,/title/tt0110912/videogallery/?ref_=tt_vi_sm,/title/tt0110912/mediaviewer/rm3998665728/?ref_=tt_mi_sm,/title/tt0110912/technical?ref_=tt_spec_sm
VGhlIElkZWEgb2YgWW91,"Solène, a 40-year-old single mom, begins an unexpected romance with 24-year-old Hayes Campbell, the lead singer of August Moon, the hottest boy band on the planet.","[<li class=""ipc-inline-list__item sc-9e83797f-1 cxyOpW"" role=""presentation""><a aria-disabled=""false"" class=""ipc-link ipc-link--baseAlt ipc-link--touch-target sc-9e83797f-2 cfrylA isReview"" href=""/title/tt9466114/reviews/?ref_=tt_ov_rt"" role=""button"" tabindex=""0""><span class=""three-Elements""><span class=""score"">3</span><span class=""label"">User reviews</span></span></a></li>, <li class=""ipc-inline-list__item sc-9e83797f-1 cxyOpW"" role=""presentation""><a aria-disabled=""false"" class=""ipc-link ipc-link--baseAlt ipc-link--touch-target sc-9e83797f-2 cfrylA isReview"" href=""/title/tt9466114/externalreviews/?ref_=tt_ov_rt"" role=""button"" tabindex=""0""><span class=""three-Elements""><span class=""score"">13</span><span class=""label"">Critic reviews</span></span></a></li>, <li class=""ipc-inline-list__item sc-9e83797f-1 cxyOpW"" role=""presentation""><a aria-disabled=""false"" class=""ipc-link ipc-link--baseAlt ipc-link--touch-target sc-9e83797f-2 cfrylA isReview"" href=""/title/tt9466114/criticreviews/?ref_=tt_ov_rt"" role=""button"" tabindex=""0""><span class=""three-Elements""><span class=""score""><span class=""sc-b0901df4-0 bcQdDJ metacritic-score-box"" style=""background-color:#54A72A"">77</span></span><span class=""label""><span class=""metacritic-score-label"">Metascore</span></span></span></a></li>]","['/title/tt9466114/reviews/?ref_=tt_ov_rt', '3', 'User reviews']","['/title/tt9466114/externalreviews/?ref_=tt_ov_rt', '13', 'Critic reviews']","['/title/tt9466114/criticreviews/?ref_=tt_ov_rt', '77', '77']",/title/tt9466114/fullcredits/cast?ref_=tt_ov_st_sm,"Fans believe the romance novel was inspired by Harry Styles because Hayes Campbell is a young, British musician who is the lead singer of his group August Moon, much like the former One Direction singer. Harry and Hayes also share the same taste in women, as the ""Watermelon Sugar"" singer dated Olivia Wilde, who is 10 years older than he is.",1 nomination,DirectorMichael Showalter,1 nomination,/title/tt9466114/fullcredits/cast/?ref_=tt_cl_sm,/title/tt9466114/faq/?ref_=tt_faq_sm,/title/tt9466114/videogallery/?ref_=tt_vi_sm,/title/tt9466114/mediaviewer/rm3062253313/?ref_=tt_mi_sm,/title/tt9466114/technical?ref_=tt_spec_sm
U3BsaXQ=,Three girls are kidnapped by a man with a diagnosed 23 distinct personalities. They must try to escape before the apparent emergence of a frightful new 24th.,"[<li class=""ipc-inline-list__item sc-9e83797f-1 cxyOpW"" role=""presentation""><a aria-disabled=""false"" class=""ipc-link ipc-link--baseAlt ipc-link--touch-target sc-9e83797f-2 cfrylA isReview"" href=""/title/tt4972582/reviews/?ref_=tt_ov_rt"" role=""button"" tabindex=""0""><span class=""three-Elements""><span class=""score"">1.1K</span><span class=""label"">User reviews</span></span></a></li>, <li class=""ipc-inline-list__item sc-9e83797f-1 cxyOpW"" role=""presentation""><a aria-disabled=""false"" class=""ipc-link ipc-link--baseAlt ipc-link--touch-target sc-9e83797f-2 cfrylA isReview"" href=""/title/tt4972582/externalreviews/?ref_=tt_ov_rt"" role=""button"" tabindex=""0""><span class=""three-Elements""><span class=""score"">573</span><span class=""label"">Critic reviews</span></span></a></li>, <li class=""ipc-inline-list__item sc-9e83797f-1 cxyOpW"" role=""presentation""><a aria-disabled=""false"" class=""ipc-link ipc-link--baseAlt ipc-link--touch-target sc-9e83797f-2 cfrylA isReview"" href=""/title/tt4972582/criticreviews/?ref_=tt_ov_rt"" role=""button"" tabindex=""0""><span class=""three-Elements""><span class=""score""><span class=""sc-b0901df4-0 bcQdDJ metacritic-score-box"" style=""background-color:#54A72A"">63</span></span><span class=""label""><span class=""metacritic-score-label"">Metascore</span></span></span></a></li>]","['/title/tt4972582/reviews/?ref_=tt_ov_rt', '1.1K', 'User reviews']","['/title/tt4972582/externalreviews/?ref_=tt_ov_rt', '573', 'Critic reviews']","['/title/tt4972582/criticreviews/?ref_=tt_ov_rt', '63', '63']",/title/tt4972582/fullcredits/cast?ref_=tt_ov_st_sm,"Glass connects the worlds of Unbreakable and Split, but creator M. Night Shyamalan and stars Samuel L. Jackson and James McAvoy also have some surprising connections ...",10 wins & 27 nominations,DirectorM. Night Shyamalan,10 wins & 27 nominations,/title/tt4972582/fullcredits/cast/?ref_=tt_cl_sm,/title/tt4972582/faq/?ref_=tt_faq_sm,/title/tt4972582/videogallery/?ref_=tt_vi_sm,/title/tt4972582/mediaviewer/rm2869758464/?ref_=tt_mi_sm,/title/tt4972582/technical?ref_=tt_spec_sm
TG92ZQ==,"Murphy is an American living in Paris who enters a highly sexually and emotionally charged relationship with Electra. Unaware of the effect it will have on their relationship, they invite their pretty neighbor into their bed.","[<li class=""ipc-inline-list__item sc-9e83797f-1 cxyOpW"" role=""presentation""><a aria-disabled=""false"" class=""ipc-link ipc-link--baseAlt ipc-link--touch-target sc-9e83797f-2 cfrylA isReview"" href=""/title/tt3774694/reviews/?ref_=tt_ov_rt"" role=""button"" tabindex=""0""><span class=""three-Elements""><span class=""score"">180</span><span class=""label"">User reviews</span></span></a></li>, <li class=""ipc-inline-list__item sc-9e83797f-1 cxyOpW"" role=""presentation""><a aria-disabled=""false"" class=""ipc-link ipc-link--baseAlt ipc-link--touch-target sc-9e83797f-2 cfrylA isReview"" href=""/title/tt3774694/externalreviews/?ref_=tt_ov_rt"" role=""button"" tabindex=""0""><span class=""three-Elements""><span class=""score"">204</span><span class=""label"">Critic reviews</span></span></a></li>, <li class=""ipc-inline-list__item sc-9e83797f-1 cxyOpW"" role=""presentation""><a aria-disabled=""false"" class=""ipc-link ipc-link--baseAlt ipc-link--touch-target sc-9e83797f-2 cfrylA isReview"" href=""/title/tt3774694/criticreviews/?ref_=tt_ov_rt"" role=""button"" tabindex=""0""><span class=""three-Elements""><span class=""score""><span class=""sc-b0901df4-0 bcQdDJ metacritic-score-box"" style=""background-color:#BB8A00"">51</span></span><span class=""label""><span class=""metacritic-score-label"">Metascore</span></span></span></a></li>]","['/title/tt3774694/reviews/?ref_=tt_ov_rt', '180', 'User reviews']","['/title/tt3774694/externalreviews/?ref_=tt_ov_rt', '204', 'Critic reviews']","['/title/tt3774694/criticreviews/?ref_=tt_ov_rt', '51', '51']",/title/tt3774694/fullcredits/cast?ref_=tt_ov_st_sm,"Gaspar Noé said that he did not direct the actors having sex or choreograph them. He said he just put them in their positions with respect to the camera and then say, ""Okay, looks good, start the scene. Let's go."" He added, ""Once you put the people in the right positions it's okay. They know how to do it.""",2 wins & 1 nomination,DirectorGaspar Noé,2 wins & 1 nomination,/title/tt3774694/fullcredits/cast/?ref_=tt_cl_sm,/title/tt3774694/technical?ref_=tt_spec_sm,/title/tt3774694/videogallery/?ref_=tt_vi_sm,/title/tt3774694/mediaviewer/rm3898733568/?ref_=tt_mi_sm,/title/tt3774694/news/?ref_=tt_nwr_sm
V2lja2VkIExpdHRsZSBMZXR0ZXJz,"When people in Littlehampton--including conservative local Edith--begin to receive letters full of hilarious profanities, rowdy Irish migrant Rose is charged with the crime. Suspecting that something is amiss, the town's women investigate.","[<li class=""ipc-inline-list__item sc-9e83797f-1 cxyOpW"" role=""presentation""><a aria-disabled=""false"" class=""ipc-link ipc-link--baseAlt ipc-link--touch-target sc-9e83797f-2 cfrylA isReview"" href=""/title/tt20234774/reviews/?ref_=tt_ov_rt"" role=""button"" tabindex=""0""><span class=""three-Elements""><span class=""score"">98</span><span class=""label"">User reviews</span></span></a></li>, <li class=""ipc-inline-list__item sc-9e83797f-1 cxyOpW"" role=""presentation""><a aria-disabled=""false"" class=""ipc-link ipc-link--baseAlt ipc-link--touch-target sc-9e83797f-2 cfrylA isReview"" href=""/title/tt20234774/externalreviews/?ref_=tt_ov_rt"" role=""button"" tabindex=""0""><span class=""three-Elements""><span class=""score"">110</span><span class=""label"">Critic reviews</span></span></a></li>, <li class=""ipc-inline-list__item sc-9e83797f-1 cxyOpW"" role=""presentation""><a aria-disabled=""false"" class=""ipc-link ipc-link--baseAlt ipc-link--touch-target sc-9e83797f-2 cfrylA isReview"" href=""/title/tt20234774/criticreviews/?ref_=tt_ov_rt"" role=""button"" tabindex=""0""><span class=""three-Elements""><span class=""score""><span class=""sc-b0901df4-0 bcQdDJ metacritic-score-box"" style=""background-color:#BB8A00"">58</span></span><span class=""label""><span class=""metacritic-score-label"">Metascore</span></span></span></a></li>]","['/title/tt20234774/reviews/?ref_=tt_ov_rt', '98', 'User reviews']","['/title/tt20234774/externalreviews/?ref_=tt_ov_rt', '110', 'Critic reviews']","['/title/tt20234774/criticreviews/?ref_=tt_ov_rt', '58', '58']",/title/tt20234774/fullcredits/cast?ref_=tt_ov_st_sm,"Although the actual events occurred in Littlehampton, the filming did not take place there. Instead nearby Arundel and Worthing were used. Arundel was used for town and street events. All the seaside filming was carried out in Worthing.",1 nomination,DirectorThea Sharrock,1 nomination,/title/tt20234774/fullcredits/cast/?ref_=tt_cl_sm,/title/tt20234774/faq/?ref_=tt_faq_sm,/title/tt20234774/videogallery/?ref_=tt_vi_sm,/title/tt20234774/mediaviewer/rm280051713/?ref_=tt_mi_sm,/title/tt20234774/technical?ref_=tt_spec_sm
TWVu,A young woman goes on a solo vacation to the English countryside following the death of her ex-husband.,"[<li class=""ipc-inline-list__item sc-9e83797f-1 cxyOpW"" role=""presentation""><a aria-disabled=""false"" class=""ipc-link ipc-link--baseAlt ipc-link--touch-target sc-9e83797f-2 cfrylA isReview"" href=""/title/tt13841850/reviews/?ref_=tt_ov_rt"" role=""button"" tabindex=""0""><span class=""three-Elements""><span class=""score"">710</span><span class=""label"">User reviews</span></span></a></li>, <li class=""ipc-inline-list__item sc-9e83797f-1 cxyOpW"" role=""presentation""><a aria-disabled=""false"" class=""ipc-link ipc-link--baseAlt ipc-link--touch-target sc-9e83797f-2 cfrylA isReview"" href=""/title/tt13841850/externalreviews/?ref_=tt_ov_rt"" role=""button"" tabindex=""0""><span class=""three-Elements""><span class=""score"">264</span><span class=""label"">Critic reviews</span></span></a></li>, <li class=""ipc-inline-list__item sc-9e83797f-1 cxyOpW"" role=""presentation""><a aria-disabled=""false"" class=""ipc-link ipc-link--baseAlt ipc-link--touch-target sc-9e83797f-2 cfrylA isReview"" href=""/title/tt13841850/criticreviews/?ref_=tt_ov_rt"" role=""button"" tabindex=""0""><span class=""three-Elements""><span class=""score""><span class=""sc-b0901df4-0 bcQdDJ metacritic-score-box"" style=""background-color:#54A72A"">65</span></span><span class=""label""><span class=""metacritic-score-label"">Metascore</span></span></span></a></li>]","['/title/tt13841850/reviews/?ref_=tt_ov_rt', '710', 'User reviews']","['/title/tt13841850/externalreviews/?ref_=tt_ov_rt', '264', 'Critic reviews']","['/title/tt13841850/criticreviews/?ref_=tt_ov_rt', '65', '65']",/title/tt13841850/fullcredits/cast?ref_=tt_ov_st_sm,"Alex Garland's movies and TV series are ranked by IMDb ratings. We have included his screenwriting credits to keep things competitive, but we didn't include The Beach and other titles where his novels were adapted by a different writer.",2 wins & 35 nominations,DirectorAlex Garland,2 wins & 35 nominations,/title/tt13841850/fullcredits/cast/?ref_=tt_cl_sm,/title/tt13841850/faq/?ref_=tt_faq_sm,/title/tt13841850/videogallery/?ref_=tt_vi_sm,/title/tt13841850/mediaviewer/rm1413436417/?ref_=tt_mi_sm,/title/tt13841850/technical?ref_=tt_spec_sm
SnVzdGljZSBMZWFndWU6IENyaXNpcyBvbiBJbmZpbml0ZSBFYXJ0aHMgLSBQYXJ0IFR3bw==,The Anti-Monitor (the Monitor's evil counterpart) is released into the DC Multiverse and begins to destroy the different Earths that compose it. The Monitor attempts to recruit heroes from across the Multiverse to fight back.,"[<li class=""ipc-inline-list__item sc-9e83797f-1 cxyOpW"" role=""presentation""><a aria-disabled=""false"" class=""ipc-link ipc-link--baseAlt ipc-link--touch-target sc-9e83797f-2 cfrylA isReview"" href=""/title/tt30150907/reviews/?ref_=tt_ov_rt"" role=""button"" tabindex=""0""><span class=""less-than-three-Elements""><span class=""score"">9</span><span class=""label"">User reviews</span></span></a></li>, <li class=""ipc-inline-list__item sc-9e83797f-1 cxyOpW"" role=""presentation""><a aria-disabled=""false"" class=""ipc-link ipc-link--baseAlt ipc-link--touch-target sc-9e83797f-2 cfrylA isReview"" href=""/title/tt30150907/externalreviews/?ref_=tt_ov_rt"" role=""button"" tabindex=""0""><span class=""less-than-three-Elements""><span class=""score"">7</span><span class=""label"">Critic reviews</span></span></a></li>]",,,,/title/tt30150907/fullcredits/cast?ref_=tt_ov_st_sm,"This is the second adaptation of ""Crisis on Infinite Earths"" as it was previously adapted as a crossover between the CW's DC shows as Crisis on Infinite Earths: Part One (2019), Crisis on Infinite Earths: Part Two (2019), Crisis on Infinite Earths: Part Three (2019), Crisis on Infinite Earths: Part Four (2020) and Crisis on Infinite Earths: Part Five (2020).",Jeff Wamester,DirectorJeff Wamester,Jeff Wamester,/title/tt30150907/fullcredits/cast/?ref_=tt_cl_sm,/title/tt30150907/technical?ref_=tt_spec_sm,/title/tt30150907/videogallery/?ref_=tt_vi_sm,/title/tt30150907/mediaviewer/rm4008279553/?ref_=tt_mi_sm,/title/tt30150907/news/?ref_=tt_nwr_sm
VGhlIEhvbGRvdmVycw==,A cranky history teacher at a prep school is forced to remain on campus over the holidays with a grieving cook and a troubled student who has no place to go.,"[<li class=""ipc-inline-list__item sc-9e83797f-1 cxyOpW"" role=""presentation""><a aria-disabled=""false"" class=""ipc-link ipc-link--baseAlt ipc-link--touch-target sc-9e83797f-2 cfrylA isReview"" href=""/title/tt14849194/reviews/?ref_=tt_ov_rt"" role=""button"" tabindex=""0""><span class=""three-Elements""><span class=""score"">522</span><span class=""label"">User reviews</span></span></a></li>, <li class=""ipc-inline-list__item sc-9e83797f-1 cxyOpW"" role=""presentation""><a aria-disabled=""false"" class=""ipc-link ipc-link--baseAlt ipc-link--touch-target sc-9e83797f-2 cfrylA isReview"" href=""/title/tt14849194/externalreviews/?ref_=tt_ov_rt"" role=""button"" tabindex=""0""><span class=""three-Elements""><span class=""score"">273</span><span class=""label"">Critic reviews</span></span></a></li>, <li class=""ipc-inline-list__item sc-9e83797f-1 cxyOpW"" role=""presentation""><a aria-disabled=""false"" class=""ipc-link ipc-link--baseAlt ipc-link--touch-target sc-9e83797f-2 cfrylA isReview"" href=""/title/tt14849194/criticreviews/?ref_=tt_ov_rt"" role=""button"" tabindex=""0""><span class=""three-Elements""><span class=""score""><span class=""sc-b0901df4-0 bcQdDJ metacritic-score-box"" style=""background-color:#54A72A"">82</span></span><span class=""label""><span class=""metacritic-score-label"">Metascore</span></span></span></a></li>]","['/title/tt14849194/reviews/?ref_=tt_ov_rt', '522', 'User reviews']","['/title/tt14849194/externalreviews/?ref_=tt_ov_rt', '273', 'Critic reviews']","['/title/tt14849194/criticreviews/?ref_=tt_ov_rt', '82', '82']",/title/tt14849194/fullcredits/cast?ref_=tt_ov_st_sm,"Many of the scenes were filmed at Fairhaven High School in Fairhaven, Massachusetts in February 2022 during the schools February break. At this time, the area received a snow storm to the delight of the film crew since many of the scenes took place during a snowstorm. They took full advantage of the weather and the snow you see in the film was from an actual snowstorm.",134 wins & 197 nominations total,DirectorAlexander Payne,134 wins & 197 nominations total,/title/tt14849194/fullcredits/cast/?ref_=tt_cl_sm,/title/tt14849194/faq/?ref_=tt_faq_sm,/title/tt14849194/videogallery/?ref_=tt_vi_sm,/title/tt14849194/mediaviewer/rm98785793/?ref_=tt_mi_sm,/title/tt14849194/technical?ref_=tt_spec_sm
U2FzcXVhdGNoIFN1bnNldA==,A year in the life of a unique family. It captures the daily life of the Sasquatch with a level of detail and rigor that is simply unforgettable.,"[<li class=""ipc-inline-list__item sc-9e83797f-1 cxyOpW"" role=""presentation""><a aria-disabled=""false"" class=""ipc-link ipc-link--baseAlt ipc-link--touch-target sc-9e83797f-2 cfrylA isReview"" href=""/title/tt30180830/reviews/?ref_=tt_ov_rt"" role=""button"" tabindex=""0""><span class=""three-Elements""><span class=""score"">17</span><span class=""label"">User reviews</span></span></a></li>, <li class=""ipc-inline-list__item sc-9e83797f-1 cxyOpW"" role=""presentation""><a aria-disabled=""false"" class=""ipc-link ipc-link--baseAlt ipc-link--touch-target sc-9e83797f-2 cfrylA isReview"" href=""/title/tt30180830/externalreviews/?ref_=tt_ov_rt"" role=""button"" tabindex=""0""><span class=""three-Elements""><span class=""score"">55</span><span class=""label"">Critic reviews</span></span></a></li>, <li class=""ipc-inline-list__item sc-9e83797f-1 cxyOpW"" role=""presentation""><a aria-disabled=""false"" class=""ipc-link ipc-link--baseAlt ipc-link--touch-target sc-9e83797f-2 cfrylA isReview"" href=""/title/tt30180830/criticreviews/?ref_=tt_ov_rt"" role=""button"" tabindex=""0""><span class=""three-Elements""><span class=""score""><span class=""sc-b0901df4-0 bcQdDJ metacritic-score-box"" style=""background-color:#54A72A"">65</span></span><span class=""label""><span class=""metacritic-score-label"">Metascore</span></span></span></a></li>]","['/title/tt30180830/reviews/?ref_=tt_ov_rt', '17', 'User reviews']","['/title/tt30180830/externalreviews/?ref_=tt_ov_rt', '55', 'Critic reviews']","['/title/tt30180830/criticreviews/?ref_=tt_ov_rt', '65', '65']",/title/tt30180830/fullcredits/cast?ref_=tt_ov_st_sm,"No dialogue is spoken by the actors, they only speak in grunts and other guttural noises.",1 nomination,DirectorsDavid ZellnerNathan Zellner,1 nomination,/title/tt30180830/fullcredits/cast/?ref_=tt_cl_sm,/title/tt30180830/technical?ref_=tt_spec_sm,/title/tt30180830/videogallery/?ref_=tt_vi_sm,/title/tt30180830/mediaviewer/rm3105310465/?ref_=tt_mi_sm,/title/tt30180830/news/?ref_=tt_nwr_sm
